<?xml version="1.0" encoding="UTF-8"?>
<xs:schema attributeFormDefault="unqualified" elementFormDefault="qualified" xmlns:xs="http://www.w3.org/2001/XMLSchema">

  <xs:element name="biblioteca">
    <xs:complexType>
      <xs:sequence>
      
        <xs:element name="libro" maxOccurs="unbounded">
          <xs:complexType>
            <xs:sequence>
              
              <xs:element name="titulo" type="xs:string" />
              <xs:element name="autor" type="xs:string" />
              
              <xs:element name="fechaPublicacion" type="xs:gYear" />
              
              <xs:element name="editorial" type="xs:string" />
              <xs:element name="genero" type="xs:string" />
              
            </xs:sequence>
          </xs:complexType>
        </xs:element>
        
      </xs:sequence>
    </xs:complexType>
  </xs:element>

</xs:schema>