<?xml version="1.0" encoding="UTF-8"?>
<biblioteca 
  xmlns:xsi="http://www.w3.org/2001/XMLSchema-instance"
  xsi:noNamespaceSchemaLocation="biblioteca.xsd">

  <libro>
    <titulo>1984</titulo>
    <autor>George Orwell</autor>
    <fechaPublicacion>1949</fechaPublicacion>
    <editorial>Secker and Warburg</editorial>
    <genero>Ficción distópica</genero>
  </libro>

  <libro>
    <titulo>Don Quijote de la Mancha</titulo>
    <autor>Miguel de Cervantes</autor>
    <fechaPublicacion>1605</fechaPublicacion>
    <editorial>Francisco de Robles</editorial>
    <genero>Novela de caballerías</genero>
  </libro>

</biblioteca>